{
  "$schema": "https://json-schema.org/draft/2020-12/schema",
  "$id": "https://ravdevops.com/schemas/findings_db.schema.json",
  "title": "FindingsDatabase",
  "type": "object",
  "description": "Database of findings tracked over time.",
  "properties": {
    "schema_version": {
      "type": "string",
      "pattern": "^[0-9]+\\.[0-9]+\\.[0-9]+$"
    },
    "created_at": { "type": "string" },
    "updated_at": { "type": "string" },
    "findings": {
      "type": "array",
      "items": { "$ref": "#/$defs/finding" }
    }
  },
  "required": ["schema_version", "findings"],
  "additionalProperties": true,
  "$defs": {
    "finding": {
      "type": "object",
      "properties": {
        "id": { "type": "string" },
        "title": { "type": "string" },
        "severity": { "type": "string" },
        "severity_model": {
          "type": "object",
          "properties": {
            "name": { "type": "string" },
            "version": { "type": "string" },
            "category": { "type": "string" },
            "axes": {
              "type": "object",
              "properties": {
                "data_exposure": { "type": "string" },
                "integrity": { "type": "string" },
                "autonomy": { "type": "string" },
                "cost_dos": { "type": "string" }
              },
              "additionalProperties": true
            },
            "method": { "type": "string" },
            "reference": { "type": "string" }
          },
          "additionalProperties": true
        },
        "status": { "type": "string" },
        "source": { "type": "string" },
        "description": { "type": "string" },
        "impact": { "type": "string" },
        "remediation": { "type": "string" },
        "evidence_refs": {
          "type": "array",
          "items": { "type": "string" }
        },
        "references": {
          "type": "array",
          "items": { "type": "string" }
        },
        "created_at": { "type": "string" },
        "updated_at": { "type": "string" }
      },
      "required": ["id", "title"],
      "additionalProperties": true
    }
  }
}
