{
  "schema_version": "0.1.0",
  "created_at": "2026-01-14T00:00:00Z",
  "updated_at": "2026-01-14T00:00:00Z",
  "findings": [
    {
      "id": "finding-001",
      "title": "Example finding title",
      "severity": "medium",
      "severity_model": {
        "name": "owasp-llm-top-10",
        "version": "2023",
        "category": "LLM06: Sensitive Information Disclosure",
        "axes": {
          "data_exposure": "medium",
          "integrity": "low",
          "autonomy": "low",
          "cost_dos": "unscored"
        },
        "method": "overall_severity_is_max_axis",
        "reference": "docs/SEVERITY_MODEL.md"
      },
      "export_fields": {
        "github": {
          "title": "Example finding title",
          "body": "## Summary\nExample finding title\n\n## Severity\nmedium\n\n## Severity Model\nowasp-llm-top-10 2023; category LLM06: Sensitive Information Disclosure; axes data_exposure=medium, integrity=low, autonomy=low, cost_dos=unscored\n\n## Description\nSynthetic description for a sample finding.\n\n## Impact\nSynthetic impact statement.\n\n## Remediation\nSynthetic remediation guidance.\n\n## Evidence\nevidence-001",
          "labels": [
            "bug-bounty",
            "ai-security",
            "severity/medium",
            "owasp/llm06"
          ]
        },
        "jira": {
          "summary": "Example finding title",
          "description": "Synthetic description for a sample finding.\n\nSeverity: medium\nSeverity model: owasp-llm-top-10 2023; category LLM06: Sensitive Information Disclosure; axes data_exposure=medium, integrity=low, autonomy=low, cost_dos=unscored\nImpact: Synthetic impact statement.\nRemediation: Synthetic remediation guidance.\nEvidence: evidence-001",
          "priority": "Medium",
          "labels": [
            "bug-bounty",
            "ai-security",
            "severity/medium",
            "owasp/llm06"
          ],
          "issue_type": "Bug"
        }
      },
      "status": "open",
      "source": "import",
      "description": "Synthetic description for a sample finding.",
      "impact": "Synthetic impact statement.",
      "remediation": "Synthetic remediation guidance.",
      "evidence_refs": [
        "evidence-001"
      ],
      "references": [
        "https://example.com"
      ],
      "created_at": "2026-01-14T00:00:00Z",
      "updated_at": "2026-01-14T00:00:00Z"
    }
  ]
}
